达人名称,平台,主页链接,粉丝数,报价,账号简介,合作品牌,合作形式,行业标签,身份标签,内容能力标签,适合目标,风险标签,媒介备注
智驾老王,抖音,https://www.douyin.com/user/sample_auto_001,86万,45000,长期做新能源车试驾和智能座舱测评,蔚来、小鹏,测评、场景体验,汽车、科技互联网,科技博主、行业专家,深度稿、案例拆解,技术解释者、专业背书,需提前沟通,内容专业但档期需要提前确认
城市通勤研究所,小红书,https://www.xiaohongshu.com/user/profile/sample_life_002,32万,28000,关注一二线城市生活方式、通勤和家庭用车,理想、特斯拉,种草、真实体验,文旅出行、汽车、生活方式,创作者,场景体验、测评、种草,品牌背书、搜索沉淀、用户教育、种草,,适合小红书搜索沉淀
AIGC视觉实验室,抖音,https://www.douyin.com/user/sample_aigc_003,120万,75000,擅长AI视觉大片、科技感短视频和创意TVC,华为、极氪,创意TVC、视觉大片,3C数码、AI软件、汽车,科技博主,创意TVC、场景体验、测评,公关破圈、品牌背书、新品预热、曝光、用户教育,,声量潜力高但真实体验需要补足
科技产品经理Leo,B站,https://space.bilibili.com/10003,45万,35000,做科技产品、AI软件和智能硬件深度解释,飞书、钉钉,专业科普、口播解释,3C数码、AI软件、职场教育,行业专家、专栏作者,专业科普、口播解释,品牌背书、用户教育,,适合B端信任和用户教育
成分党小夏,小红书,https://www.xiaohongshu.com/user/profile/sample_beauty_004,58万,42000,专注护肤成分、抗老精华和真实测评,兰蔻、修丽可,测评、种草,美妆护肤,测评达人、创作者,测评、种草,品牌背书、搜索沉淀、用户教育、种草,,美妆护肤适配强
